### ISSUE TITLE
Event stream stalls (Siemens Dishwasher SN53HS00BD/04)

### ISSUE THREAD

**Issue by dinneatgithub** [thoukydides/homebridge-homeconnect#74]
#### Description of Issue
Push Notifications from Homeconnect server does not come through after some time, after restart homebridge (not the linux server, just homebridge) it works again for some time (some minutes/few hours). All indiciates to me a missing keepalive towards the homeconnect infrastructure.
My device is a Siemens dishwasher.

#### Plugin Version
I run homebridge 1.4.0 on Ubuntu 20.04 with homebridge-homeconnect v0.23.4 (so all most recent versions)
Node.js Version | v16.13.2

#### HomeKit App(s)
Not related to Homekit as I can see in the homebridge console if there is a push notification from homeconnect infrastructure or not. I can trigger a push notification by switching on and off the dishwasher. Directly after a homebridge restart, it works. So it seems the keepalive is not done properly. 

[2/7/2022, 1:17:37 PM] [HomeConnect] [Geschirrspüler] On
[2/7/2022, 1:17:38 PM] [HomeConnect] [Geschirrspüler] Inactive (Ready)
[2/7/2022, 1:17:46 PM] [HomeConnect] [Geschirrspüler] Active (Run)

**Comment by thoukydides** [comment]
By "push notifications" I am guessing that you mean the event monitoring channel ([/api/homeappliances/{haId}/events](https://apiclient.home-connect.com/#!/status_events/get_events)).

This is just a long-lived http GET connection. The Home Connect server sends a `KEEP-ALIVE` event every 55 seconds, and this plugin implements a timeout of 120 seconds after which it tears-down and reestablishes the connection. That functionality has been extensively tested, and works reliably for me.

If you are seeing this as a new problem then I suspect that it is due to the recent down-time of the Home Connect servers: https://www.thouky.co.uk/homeconnect.html

If you see this problem when the Home Connect servers are working reliably, then please provide a complete log, with homebridge debug enabled (using the `-D` command line option). This should cover the whole period from when homebridge is started, and continue past the point where the plugin appears to stop receiving notifications of appliance state changes. Please also provide a summary of what appliance state changes you expected to see and their approximate time.

**Comment by thoukydides** [comment]
If the Home Connect servers are not generating the `KEEP-ALIVE` messages every 55 seconds then that is a bug with their implementation. There is nothing that I can do about that.

If something in your network requires keep-alive activity more frequently than every 55 seconds then I would consider that to be a bug with your network equipment, bearing in mind that the default TCP idle timeout is 300 seconds.

**Comment by dinneatgithub** [comment]
Thanks for the quick response. The issue is there since more than 14 days, so I don't think it's related to the recent outage. 
I'll send the debug log with -D. Hopefully will be ready latest the weekend.

**Comment by dinneatgithub** [comment]
I can confirm that when I flush conntrack at my Ubiquity Edgerouter, the connection drop is detected in the log and it is re-establilshed.

`[2/7/2022, 6:21:53 PM] Registering platform 'homebridge-homeconnect.HomeConnect'
[2/7/2022, 6:21:54 PM] [HomeConnect] Initializing HomeConnect platform...
[2/7/2022, 6:21:54 PM] [HomeConnect] new HomeConnectPlatform
[2/7/2022, 6:21:54 PM] [HomeConnect] Restored 1 cached accessories
[2/7/2022, 6:21:54 PM] [HomeConnect] Starting events stream for all appliances
[2/7/2022, 6:21:54 PM] [HomeConnect] [Geschirrspüler] Siemens Dishwasher (E-Nr: SN53HS00BD/04)
[2/7/2022, 6:21:57 PM] [HomeConnect] [Geschirrspüler] Door open
[2/7/2022, 6:21:57 PM] [HomeConnect] [Geschirrspüler] Inactive (Inactive)
[2/7/2022, 6:21:57 PM] [HomeConnect] [Geschirrspüler] Remote operation NOT enabled (remote control activated, remote start disallowed)
[2/7/2022, 6:21:57 PM] [HomeConnect] [Geschirrspüler] No program running
[2/7/2022, 6:21:57 PM] [HomeConnect] [Geschirrspüler] Off
[2/7/2022, 6:21:57 PM] [HomeConnect] [Geschirrspüler] Connected
[2/7/2022, 6:21:57 PM] [HomeConnect] [Geschirrspüler] Off
[2/7/2022, 6:21:57 PM] [HomeConnect] [Geschirrspüler] Off
[2/7/2022, 6:21:57 PM] [HomeConnect] [Geschirrspüler] Off
[2/7/2022, 6:21:57 PM] [HomeConnect] [Geschirrspüler] Does not support Functional Light
[2/7/2022, 6:21:57 PM] [HomeConnect] [Geschirrspüler] Does not support Ambient Light
[2/7/2022, 6:21:57 PM] [HomeConnect] [Geschirrspüler] Can be switched off
[2/7/2022, 6:21:57 PM] [HomeConnect] [Geschirrspüler] Finished reading available program options
[2/7/2022, 6:21:57 PM] [HomeConnect] [Geschirrspüler] Adding services for 7 programs
[2/7/2022, 6:21:57 PM] [HomeConnect] [Geschirrspüler]     'Intensiv 70' (Dishcare.Dishwasher.Program.Intensiv70)
[2/7/2022, 6:21:57 PM] [HomeConnect] [Geschirrspüler]     'Auto 45-65' (Dishcare.Dishwasher.Program.Auto2)
[2/7/2022, 6:21:57 PM] [HomeConnect] [Geschirrspüler]     'Eco 50' (Dishcare.Dishwasher.Program.Eco50)
[2/7/2022, 6:21:57 PM] [HomeConnect] [Geschirrspüler]     'Vorspülen' (Dishcare.Dishwasher.Program.PreRinse)
[2/7/2022, 6:21:57 PM] [HomeConnect] [Geschirrspüler]     'Schnell 65' (Dishcare.Dishwasher.Program.Quick65)
[2/7/2022, 6:21:57 PM] [HomeConnect] [Geschirrspüler]     'Extra 60' (Dishcare.Dishwasher.Program.Super60)
[2/7/2022, 6:21:57 PM] [HomeConnect] [Geschirrspüler]     'Maschinenpflege' (Dishcare.Dishwasher.Program.MachineCare)
[2/7/2022, 6:21:57 PM] [HomeConnect] [Geschirrspüler] Removing services for 0 programs
[2/7/2022, 6:22:03 PM] [HomeConnect] [Geschirrspüler] On
[2/7/2022, 6:22:04 PM] [HomeConnect] [Geschirrspüler] Inactive (Ready)
[2/7/2022, 6:22:04 PM] [HomeConnect] [Geschirrspüler] Program 'Auto 45-65' (Dishcare.Dishwasher.Program.Auto2) inactive
[2/7/2022, 6:22:10 PM] [HomeConnect] [Geschirrspüler] Off
[2/7/2022, 6:22:10 PM] [HomeConnect] [Geschirrspüler] Inactive (Inactive)
[2/7/2022, 6:31:03 PM] [HomeConnect] [Geschirrspüler] On
[2/7/2022, 6:31:04 PM] [HomeConnect] [Geschirrspüler] Inactive (Ready)
[2/7/2022, 6:31:06 PM] [HomeConnect] [Geschirrspüler] Off
[2/7/2022, 6:31:06 PM] [HomeConnect] [Geschirrspüler] Inactive (Inactive)
[2/7/2022, 6:31:06 PM] [HomeConnect] [Geschirrspüler] Off
[2/7/2022, 6:47:49 PM] [HomeConnect] [Geschirrspüler] On
[2/7/2022, 6:47:49 PM] [HomeConnect] [Geschirrspüler] Inactive (Ready)
[2/7/2022, 6:47:55 PM] [HomeConnect] [Geschirrspüler] Off
[2/7/2022, 6:47:55 PM] [HomeConnect] [Geschirrspüler] Inactive (Inactive)
[2/7/2022, 6:47:55 PM] [HomeConnect] [Geschirrspüler] Off
[2/7/2022, 6:49:55 PM] [HomeConnect] Terminated events stream for all appliances: ESOCKETTIMEDOUT
[2/7/2022, 6:49:55 PM] [HomeConnect] Starting events stream for all appliances
[2/7/2022, 6:53:11 PM] [HomeConnect] [Geschirrspüler] On
[2/7/2022, 6:53:11 PM] [HomeConnect] [Geschirrspüler] Inactive (Ready)
[2/7/2022, 6:53:20 PM] [HomeConnect] [Geschirrspüler] Off
[2/7/2022, 6:53:20 PM] [HomeConnect] [Geschirrspüler] Inactive (Inactive)
[2/7/2022, 6:55:35 PM] [HomeConnect] Terminated events stream for all appliances: ESOCKETTIMEDOUT
[2/7/2022, 6:55:35 PM] [HomeConnect] Starting events stream for all appliances
[2/7/2022, 6:55:44 PM] [HomeConnect] [Geschirrspüler] On
[2/7/2022, 6:55:45 PM] [HomeConnect] [Geschirrspüler] Inactive (Ready)
[2/7/2022, 6:55:47 PM] [HomeConnect] [Geschirrspüler] Off
[2/7/2022, 6:55:47 PM] [HomeConnect] [Geschirrspüler] Inactive (Inactive)
[2/7/2022, 8:10:20 PM] [HomeConnect] Terminated events stream for all appliances: ESOCKETTIMEDOUT
[2/7/2022, 8:10:20 PM] [HomeConnect] Starting events stream for all appliances
[2/7/2022, 8:17:06 PM] [HomeConnect] [Geschirrspüler] On
[2/7/2022, 8:17:07 PM] [HomeConnect] [Geschirrspüler] Inactive (Ready)
[2/7/2022, 8:17:07 PM] [HomeConnect] [Geschirrspüler] Off
[2/7/2022, 8:17:07 PM] [HomeConnect] [Geschirrspüler] Inactive (Inactive)
[2/7/2022, 8:22:46 PM] [HomeConnect] [Geschirrspüler] On
[2/7/2022, 8:22:46 PM] [HomeConnect] [Geschirrspüler] Inactive (Ready)
[2/7/2022, 8:22:50 PM] [HomeConnect] [Geschirrspüler] Off
[2/7/2022, 8:22:50 PM] [HomeConnect] [Geschirrspüler] Inactive (Inactive)
[2/7/2022, 8:22:50 PM] [HomeConnect] [Geschirrspüler] Off
`

I flushed conntrack ("sudo conntrack -F") approx 120 secs before the entries ESOCKETTIMEDOUT

However, I have a problem starting -D mode. I run a homematic setup with more than 80 devices. My logfile gets crazy populated in a very few minutes. Is there a way to start debug just for HomeConnect plugin and for no other plugin?

**Comment by dinneatgithub** [comment]
Additional question: How can I identify the connection from homebridge to HomeConnect infrastructure?
Based on my readings, I would assume: it is tcp, target port is 443
`
sudo conntrack -L | grep "ESTABLISHED src=192.168.x.xxx" | grep tcp | grep -v TIME_WAIT | grep -v CLOSE
conntrack v0.9.14 (conntrack-tools): 971 flow entries have been shown.
tcp      6 293 ESTABLISHED src=192.168.x.xxx dst=3.68.21.93 sport=53038 dport=443 src=3.68.21.93 dst=109.xxx.xxx.xxx sport=443 dport=53038 [ASSURED] mark=1694498816 use=1
`

Would this filter be right?

**Comment by dinneatgithub** [comment]
Thanks for clarifying. While I'll plan how to setup a second instance not interfering my PROD environment here, I'll have a second option monitoring the connection on the edgerouter. Even though I cannot easily inspect the HTTPS encrypted connection, but the packet size I can put a rough guess if appropriate packets are sent when expected or not. Luckily I can trigger the behavior easily by simply switching on/off the dishwasher. In the good case I directly see those lines in homebridge.log

`[2/7/2022, 8:36:46 PM] [HomeConnect] [Geschirrspüler] On
[2/7/2022, 8:36:47 PM] [HomeConnect] [Geschirrspüler] Inactive (Ready)
[2/7/2022, 8:36:48 PM] [HomeConnect] [Geschirrspüler] Off
[2/7/2022, 8:36:48 PM] [HomeConnect] [Geschirrspüler] Inactive (Inactive)
`

I'll come back with further details

**Comment by dinneatgithub** [comment]
After something between 60 to 100 minutes, there are no events received any more. I see that the connection is still active, when running a tcpdump on my pppoe interface 
`sudo tcpdump -i pppoe0 -vv host 3.68.21.93`
I see the keepalive like this
`21:39:08.782269 IP (tos 0x0, ttl 247, id 8638, offset 0, flags [DF], proto TCP (6), length 111)
    ec2-3-68-21-93.eu-central-1.compute.amazonaws.com.https > xxxxxx.53038: Flags [P.], cksum 0x6015 (correct), seq 3236399460:3236399519, ack 966541210, win 121, options [nop,nop,TS val 2812082907 ecr 3524002054], length 59
21:39:08.782780 IP (tos 0x0, ttl 63, id 32057, offset 0, flags [DF], proto TCP (6), length 52)
    xxxxxxxxxxxx.53038 > ec2-3-68-21-93.eu-central-1.compute.amazonaws.com.https: Flags [.], cksum 0x3618 (correct), seq 1, ack 59, win 501, options [nop,nop,TS val 3524057053 ecr 2812082907], length 0
`

length 111 bytes in, length 52 bytes out as the response. The packet sizes are fixed, so I assume that is the heartbeat/keepalive.

Now the interesting fact: when switching dishwasher on/off, I can't see a change here. So HomeConnect Server does not signal it.

Then I did a flush of conntrack and waited for a minute to see the heartbeat again. Then I pressed the on/off button. Now I see the event coming in by a different packet size:

`21:45:43.946913 IP (tos 0x0, ttl 244, id 4022, offset 0, flags [DF], proto TCP (6), length 111)
    ec2-3-68-21-93.eu-central-1.compute.amazonaws.com.https > xxxxxxxx.53048: Flags [P.], cksum 0x822c (correct), seq 59:118, ack 1, win 121, options [nop,nop,TS val 2812478070 ecr 3524397219], length 59
21:45:43.947583 IP (tos 0x0, ttl 63, id 9845, offset 0, flags [DF], proto TCP (6), length 52)
    xxxxxxxx.53048 > ec2-3-68-21-93.eu-central-1.compute.amazonaws.com.https: Flags [.], cksum 0x8234 (correct), seq 1, ack 118, win 501, options [nop,nop,TS val 3524452218 ecr 2812478070], length 0
21:46:30.949462 IP (tos 0x0, ttl 247, id 8653, offset 0, flags [DF], proto TCP (6), length 111)
    ec2-3-68-21-93.eu-central-1.compute.amazonaws.com.https > xxxxxxxx.53038: Flags [P.], cksum 0x09d5 (correct), seq 0:59, ack 1, win 121, options [nop,nop,TS val 2812525074 ecr 3524222055], length 59
21:46:33.654153 IP (tos 0x0, ttl 244, id 4023, offset 0, flags [DF], proto TCP (6), length 439)
    ec2-3-68-21-93.eu-central-1.compute.amazonaws.com.https > xxxxxxxx.53048: Flags [P.], cksum 0x00c8 (correct), seq 118:505, ack 1, win 121, options [nop,nop,TS val 2812527778 ecr 3524452218], length 387
21:46:33.655009 IP (tos 0x0, ttl 63, id 9846, offset 0, flags [DF], proto TCP (6), length 52)
    xxxxxxxx.53048 > ec2-3-68-21-93.eu-central-1.compute.amazonaws.com.https: Flags [.], cksum 0xfc58 (correct), seq 1, ack 505, win 501, options [nop,nop,TS val 3524501925 ecr 2812527778], length 0
21:46:34.057132 IP (tos 0x0, ttl 244, id 4024, offset 0, flags [DF], proto TCP (6), length 454)
    ec2-3-68-21-93.eu-central-1.compute.amazonaws.com.https > xxxxxxxx.53048: Flags [P.], cksum 0x8aac (correct), seq 505:907, ack 1, win 121, options [nop,nop,TS val 2812528181 ecr 3524501925], length 402
21:46:34.057991 IP (tos 0x0, ttl 63, id 9847, offset 0, flags [DF], proto TCP (6), length 52)
    xxxxxxxx.53048 > ec2-3-68-21-93.eu-central-1.compute.amazonaws.com.https: Flags [.], cksum 0xf7a0 (correct), seq 1, ack 907, win 501, options [nop,nop,TS val 3524502328 ecr 2812528181], length 0
21:46:36.981689 IP (tos 0x0, ttl 244, id 4025, offset 0, flags [DF], proto TCP (6), length 441)
    ec2-3-68-21-93.eu-central-1.compute.amazonaws.com.https > xxxxxxxx.53048: Flags [P.], cksum 0xe551 (correct), seq 907:1296, ack 1, win 121, options [nop,nop,TS val 2812531106 ecr 3524502328], length 389
21:46:36.982462 IP (tos 0x0, ttl 63, id 9848, offset 0, flags [DF], proto TCP (6), length 52)
    xxxxxxxx.53048 > ec2-3-68-21-93.eu-central-1.compute.amazonaws.com.https: Flags [.], cksum 0xdf41 (correct), seq 1, ack 1296, win 501, options [nop,nop,TS val 3524505253 ecr 2812531106], length 0
`

I pushed the button at 21:46:33.654153 when you see the packet length 439


My conclusion of today's analysis: It seems to me that the connection from homebridge to homeconnect API is stable. And is restarted when I flush conntrack. However it seems that HomeConnect API Services stop sending events after some time of idleness. Idleness can be extended after an event being sent. But if >45 (?) minutes no event -> then it remains at the hearbeat without any events sent any more.

Can anyone confirm this behavior with a Siemens Dishwasher?

**Comment by thoukydides** [comment]
I use this plugin with a [Siemens iQ700 Dishwasher](https://www.siemens-home.bsh-group.com/uk/mysiemens/products/0004436388) (SN678D06TG/53) but do not see this problem. It sometimes goes for days without any events (other than the `KEEP-ALIVE`), but then properly reports events when the dishwasher state changes.

From your description this appears to be a bug in the Home Connect implementation. It is extremely unlikely that I can do anything within this plugin to workaround it. The only obvious option would be to terminate and reestablish the event stream every 30 minutes or so, but that would risk (i) exceeding the [Home Connect Rate Limits](https://github.com/thoukydides/homebridge-homeconnect/wiki/Rate-Limits) and (ii) losing events between ending one stream and starting its replacement. Given that I am not seeing this issue, and nobody else has reported similar issues, I am not willing to make that change.

The only thing that I can suggest is to report the issue: https://developer.home-connect.com/support/contact

If you would prefer me to do that then you will need to provide the **model number** and `haID` of your appliances, since the Home Connect team always ask for that when issues may be related to specific models/devices. There are many ways to find this, e.g.:
* It can be found in the `~/.homebridge/.homebridge-homeconnect-v1.schema.json` file.
* It can be found in the `~/.homebridge/homebridge-homeconnect/persist/130b9cf2dc079eb8116e6fca2c2ec001` file.
* It is part of most URLs that the plugin issues (other than starting the event stream and asking for the list of appliances once each hour). All of these requests appear in the debug (`-D`) log.
* It is written to the normal log (does not require debug to be enabled) when a HomeKit **Identify** operation is performed on the appliance.

**Comment by dinneatgithub** [comment]
Thanks for your great support! I already opened a ticket yesterday, but I assume it might help if you open as well as you are more detailled in homeconnect than I am. I will provide the requested details. In the meantime I want to do further tests around the timing to prove my idea of the deadly timeout after last event. As I expect something around 60 minutes this is a little time consuming :) But I can debug it quite well as I see in tcpdump packet analysis if there is just the normal keep alive going on or real event payload.

I had another idea to inspect the real HTTP traffic instead of checking just the packet sizes. Does your plugin check CA validity of the SSL certificate of homeconnect? I was thinking of setting up `mitmproxy` as I have bind running locally, I can forge the DNS for homeconnect to localhost. But that wouldn't work out if SSL certificates are validated. Can that check be disabled?

**Comment by thoukydides** [comment]
> Does your plugin check CA validity of the SSL certificate of homeconnect? I was thinking of setting up mitmproxy as I have bind running locally, I can forge the DNS for homeconnect to localhost. But that wouldn't work out if SSL certificates are validated. Can that check be disabled?

This plugin uses the [request](https://github.com/request/request) package. It looks like you would need to modify [lib/homeconnect_api.js](https://github.com/thoukydides/homebridge-homeconnect/blob/master/lib/homeconnect_api.js) to add one or both of the following to the `options` object in `requestRaw` and `requestStreamRaw` functions:
* `strictSSL` to disable strict certificate checking
* `agentOptions.ca` to provide the certificates that you want trusted

I haven’t tried this though…

**Comment by thoukydides** [comment]
Thank you for those details. I have now reported the problem to the Home Connect team.

I normally mask out the haID values for my appliances when I post examples, although it should not really matter. Access to the appliances is still gated via the OAuth authentication, and the haID is not obviously related to the FD or SN numbers.

**Comment by thoukydides** [comment]
The same issue has been reported for a Bosch Dishwasher SMV8YCX01E/17 in #72. In that case events for other appliances continued to be received by the plugin, even though those from the dishwasher stopped.

**Comment by thoukydides** [comment]
I have provided this additional information to the Home Connect team. Based on previous experience there is unlikely to any response, unless they want additional information. They are unlikely to provide any feedback, other that an entry in their [Changelog](https://developer.home-connect.com/changelog) if they actually fix the issue and consider it sufficiently important to tell anyone about.

Given that the issue is clearly with the Home Connect API implementation, and not due to this plugin, I am going to close this issue.

**Comment by dinneatgithub** [comment]
Since yesterday, Tuesday 15-Feb-2022, my long-running event channel connection receives status updates again. Hope this is permanent fix.

**Comment by thoukydides** [comment]
That sounds encouraging.
Fingers crossed!

**Comment by thoukydides** [comment]
Responses from the Home Connect Developer Team...

18th February 2022:
> Sorry for late response. I will check internally and get back to you.

3rd March 2022:
> Is it something that you or users of your software still observe?

@dinneatgithub / @smhex are events now being reported reliably for you, or are you still seeing the events stopping for one or more appliances?

**Comment by dinneatgithub** [comment]
Here it works approx since mid February. I just had a case 2 days ago where I didn't get the update for running+finished, but I think that was a one-timer. Works currently, hoping they did a permanent fix.

**Comment by thoukydides** [comment]
Thanks for the update @dinneatgithub. I will let the Home Connect Developer Team know.

If you see the issue again then please either contact the HC team directly, or post here and I will pass it along.

**Comment by smhex** [comment]
I have no problems with my dishwasher. Everything works as expected. However, I have still issues with my washer and the dryer. I was not able to figure out the circumstances which led to the missing events. I will dig into this on the weekend. What I see is that my Lametric clock also misses the events. That might be related or not. In any case the HomeConnect app works as expected.

**Comment by dinneatgithub** [comment]
It is getting instable again. As written, day before yesterday there were events not passing through, then it worked again. Yesterday evening again, both the start event as well as the end event were not captured.

PS: @smhex: I assume the HomeConnect app works because it establishes always a new connection. And my experience was, that with a new connection, typically the events were received at the beginning. Then it sometimes gets silent, while the HTTP-heartbeat is still received.

**Comment by thoukydides** [comment]
Thank you @dinneatgithub and @smhex. I provided those updates to the Home Connect Developer Team. Looks like they have more work to do...

**Comment by thoukydides** [comment]
Latest from the Home Connect Developer Team:
> I'd like to investigate these problems on our side but I would need HAIDs and timestamps. Are you able to provide me such information?

I have already provided the haIDs for the problem appliances. However, if you can provide timestamps (for when the event stream is established and when events stop being reported - either from the homebridge log files or by monitoring the TCP connection) then I will pass that on.

**Comment by dinneatgithub** [comment]
Will do so. Instructed my wife as well to take a note when dishwasher starts and the start-event is not caught. The network streak with the heartbeat is reliable stable and reset with my DSL line reset every day 3:30am CE(S)T

**Comment by smhex** [comment]
Just checked - dish washer is running and is getting events as expected. However, neither the power state nor events were detected for my washer. I quickly  restarted Homebridge. Events are coming now for the washer. I will come back with the results. Remaining time for both appliances is about 2 hours...

**Comment by smhex** [comment]
So, dish washer and washer finished their programs. Everything works as expected. However, the dryer was startet in between - again no events at all and no power state update. Restarted Homebridge - dryer is detected and remaining program time is logged. Weird somehow...

**Comment by marioverhaeg** [comment]
I'm experiencing the same issue with my own implementation connecting to HomeConnect. I have also reached out to their support e-mail but have not received a response. I will provide an update here as soon as I have more information as well.

**Comment by smhex** [comment]
Interesting - the only appliance which works reliable all the time is my dishwasher...

**Comment by thoukydides** [comment]
Latest from the Home Connect Developer Team:

> I'm writing to you both as you raised the same issue with SSE channels. It's puzzling issue and unfortunately not a quick fix so the better info we can work with the faster it could be solved.
>
> Also sorry for not being very responsive on my side, there's simply a lot going on and we have very limited resources (i.e.: me ;) ) to handle all support topics.
>
> It's a problem we don't observe on our side so having clear understanding what's going on is paramount. Why does it happen for some users and not for others? Also when your device is offline, what kind of messages do you expect – since there are no updates from appliances there's nothing coming back through SSE channel I believe.
>
> Can you or others with similar problems certainly exclude connectivity problems like appliance disconnection, router instabilities, etc.?

I am still not seeing this issue with my own appliances, so I cannot provide the Home Connect Team with any useful information to help them resolve this. @dinneatgithub and @smhex, if you have anything to contribute then would you like to be added to the email thread with the HC team and @marioverhaeg?

**Comment by marioverhaeg** [comment]
I have also received the mail and will provide a clear reproduction scenario this evening. I will also post that here.

**Comment by dinneatgithub** [comment]
I can exclude network/DSL issues on my side. That is closely monitored here for other reasons.

I don't know about their software architecture, but it seems to me like either the "event receiving unit" or the "event distribution unit" in their deployment sometimes seems to be down. In this cases, the incoming events from the dishwasher are not distributed to the registered listeners. Then they restart this service and it works again. 

We had outages again on events taking place on 22-Mar-2022 02:00pm CET and 23-Mar-2022, 12:30pm CET. Starting, stopping the dishwasher didn't came through the event channel. The days before it ran stable.

**Comment by smhex** [comment]
Hi, I will try to catch some debug logs next time my appliances run. Maybe we'll find something. My guess is that for whatever reason the server side of the event streams stops sending events....

**Comment by smhex** [comment]
Unfortunately no progress on my side. Instead of any findings I get 

```
[3/31/2022, 6:19:54 PM] [homebridge-homeconnect] Terminated events stream for all appliances: Home Connect API error: Too Many Requests
```
There are no changes on my side so far. I don't have an explanation for this error...

I will report back after resolving this.

**Comment by thoukydides** [comment]
That's curious @smhex. I have never seen that precise error.

For most rate limit issues the API returns an error like `The rate limit for requests from this client was reached. Requests are blocked during the remaining period of 1 seconds. [429]`, i.e. explaining which rate limit was exceeded and indicating when the limit will expire and new requests will be accepted (the latter also being available in a `retry-after` header).

The only time that I have seen a message similar to the one you report is for the OAuth endpoint, where refreshing the access token more than 100 times per day results in a `Too many requests` error. Note the different capitalisation of the error message. I have never seen that (or similar) error returned by any other endpoint.

Of course, the API documentation is rather imprecise, saying that "*Generally* if too many requests are sent, further requests are rejected with the HTTP status code 429." The "*Generally*" implies that sometimes it doesn't...

My best guess is that you have hit one of the rate limits that isn't time-based, most likely "10 event monitoring channels per client and Home Connect user account at any time (the request for further channels will be blocked)". That might occur if the plugin keeps restarting the event stream because it thinks the connection has been lost, but the old connections haven't been torn-down at the Home Connect servers.

**Comment by marioverhaeg** [comment]
I'm waiting for a response from my reproduction scenario on the 25-03-2022:
(note these are debug logs from my own applications, but I still think the problem is the same you are experiencing)

_When the device is offline and becomes online, we expect a "CONNECTED" message. I can reproduce the situation at this moment. Times are in CET (Germany / Netherlands):
Washer turned-on: 06:53 => No "CONNECTED" message, KEEP-ALIVE is running (see log below); this also means the TCP connection to the API is alive.
Washer changes program: 06:54: No messages, just KEEP-ALIVE
Washer turned-off: 06:54 => No "DISCONNECTED" message, KEEP-ALIVE is running.

Log (including HaID):
2022-03-25 06:52:46.015 +01:00 [DBG] <51> Received message: data:
2022-03-25 06:52:46.015 +01:00 [DBG] <51> Waiting for message...
2022-03-25 06:52:46.016 +01:00 [DBG] <51> Received message: id:BOSCH-WAXH2K75NL-xxx
2022-03-25 06:52:46.016 +01:00 [DBG] <51> Last line of message detected.
2022-03-25 06:52:46.020 +01:00 [DBG] <51> KEEP-ALIVE received, restarting timer...
2022-03-25 06:52:46.020 +01:00 [DBG] <51> KEEP-ALIVE Timer (re)started.
2022-03-25 06:52:46.021 +01:00 [DBG] <51> Clearing dictionary...
2022-03-25 06:52:46.021 +01:00 [DBG] <51> Waiting for message...
2022-03-25 06:52:46.021 +01:00 [DBG] <51> Received message:
2022-03-25 06:53:41.120 +01:00 [DBG] <51> Waiting for message...
2022-03-25 06:53:41.120 +01:00 [DBG] <51> Received message: event:KEEP-ALIVE
2022-03-25 06:53:41.120 +01:00 [DBG] <51> Waiting for message...
2022-03-25 06:53:41.120 +01:00 [DBG] <51> Received message: data:
2022-03-25 06:53:41.120 +01:00 [DBG] <51> Waiting for message...
2022-03-25 06:53:41.120 +01:00 [DBG] <51> Received message: id:BOSCH-WAXH2K75NL-xxx
2022-03-25 06:53:41.121 +01:00 [DBG] <51> Last line of message detected.
2022-03-25 06:53:41.121 +01:00 [DBG] <51> KEEP-ALIVE received, restarting timer...
2022-03-25 06:53:41.121 +01:00 [DBG] <51> KEEP-ALIVE Timer (re)started.
2022-03-25 06:53:41.121 +01:00 [DBG] <51> Clearing dictionary...
2022-03-25 06:53:41.121 +01:00 [DBG] <51> Waiting for message...
2022-03-25 06:53:41.121 +01:00 [DBG] <51> Received message:
2022-03-25 06:53:55.968 +01:00 [DBG] <51> Waiting for message...
2022-03-25 06:53:55.968 +01:00 [DBG] <51> Received message: event:KEEP-ALIVE
2022-03-25 06:53:55.968 +01:00 [DBG] <51> Waiting for message...
2022-03-25 06:53:55.968 +01:00 [DBG] <51> Received message: data:
2022-03-25 06:53:55.969 +01:00 [DBG] <51> Waiting for message...
2022-03-25 06:53:55.969 +01:00 [DBG] <51> Received message: id:BOSCH-WAXH2K75NL-xxx
2022-03-25 06:53:55.969 +01:00 [DBG] <51> Last line of message detected.
2022-03-25 06:53:55.969 +01:00 [DBG] <51> KEEP-ALIVE received, restarting timer...
2022-03-25 06:53:55.969 +01:00 [DBG] <51> KEEP-ALIVE Timer (re)started.
2022-03-25 06:53:55.969 +01:00 [DBG] <51> Clearing dictionary...
2022-03-25 06:53:55.969 +01:00 [DBG] <51> Waiting for message...
2022-03-25 06:53:55.970 +01:00 [DBG] <51> Received message:
2022-03-25 06:54:36.018 +01:00 [DBG] <51> Waiting for message...
2022-03-25 06:54:36.018 +01:00 [DBG] <51> Received message: event:KEEP-ALIVE
2022-03-25 06:54:36.019 +01:00 [DBG] <51> Waiting for message...
2022-03-25 06:54:36.019 +01:00 [DBG] <51> Received message: data:
2022-03-25 06:54:36.019 +01:00 [DBG] <51> Waiting for message...
2022-03-25 06:54:36.019 +01:00 [DBG] <51> Received message: id:BOSCH-WAXH2K75NL-xxx
2022-03-25 06:54:36.019 +01:00 [DBG] <51> Last line of message detected.
2022-03-25 06:54:36.019 +01:00 [DBG] <51> KEEP-ALIVE received, restarting timer...
2022-03-25 06:54:36.019 +01:00 [DBG] <51> KEEP-ALIVE Timer (re)started.
2022-03-25 06:54:36.019 +01:00 [DBG] <51> Clearing dictionary...
2022-03-25 06:54:36.019 +01:00 [DBG] <51> Waiting for message...

Restarted service:
pi@RP120:/app/Verhaeg.IoT.HomeConnect.Sensor/log $ sudo systemctl stop Verhaeg.IoT.HomeConnect.Sensor.service
pi@RP120:/app/Verhaeg.IoT.HomeConnect.Sensor/log $ sudo systemctl start Verhaeg.IoT.HomeConnect.Sensor.service

06:56: Washer turned on, just KEEP-ALIVE messages, no "CONNECTED"
06:58: changed program on washer, just KEEP-ALIVE

07:02 stopped service and cleared refresh and access tokens
07:03 started service and logged in:
2022-03-25 07:03:06.793 +01:00 [INF] <10> Received response: {
  "device_code": "758b0ef6-0a3f-4944-8ff2-67422e73953e",
  "expires_in": 600,
  "interval": 5,
  "user_code": "M8G9-TFXA",
  "verification_uri": "https://api.home-connect.com/security/oauth/device_verify",
  "verification_uri_complete": "https://api.home-connect.com/security/oauth/device_verify?user_code=M8G9-TFXA"
}
07:04 changes program on washer, events start coming:
2022-03-25 07:04:51.956 +01:00 [DBG] <16> Received message: id:BOSCH-WAXH2K75NL-68A40E4E014E
2022-03-25 07:04:51.956 +01:00 [DBG] <16> Last line of message detected.
2022-03-25 07:04:51.957 +01:00 [DBG] <16> Generating external event.
2022-03-25 07:04:51.957 +01:00 [DBG] <16> Clearing dictionary...
2022-03-25 07:04:51.958 +01:00 [DBG] <16> Waiting for message...
2022-03-25 07:04:51.958 +01:00 [DBG] <16> Received message:
2022-03-25 07:04:52.229 +01:00 [DBG] <16> Waiting for message...
2022-03-25 07:04:52.229 +01:00 [DBG] <16> Received message: event:NOTIFY
2022-03-25 07:04:52.230 +01:00 [DBG] <16> Waiting for message...
2022-03-25 07:04:52.230 +01:00 [DBG] <16> Received message: data:{"items":[{"timestamp":1648188292,"handling":"none","uri":"/api/homeappliances/BOSCH-WAXH2K75NL-xxx/programs/selected/options/BSH.Common.Option.FinishInRelative","key":"BSH.Common.Option.FinishInRelative","unit":"seconds","value":14880,"level":"hint"}],"haId":"BOSCH-WAXH2K75NL-xxx"}

It might be related to the tokens, but that would still be weird, as the authentication to the API itself is successful using the old tokens at 06:55 and I can query the API:
2022-03-25 06:55:52.173 +01:00 [DBG] <10> Trying to retrieve Device from HomeConnect service...
2022-03-25 06:55:52.173 +01:00 [INF] <10> Waiting for authentication to complete.
2022-03-25 06:55:52.184 +01:00 [DBG] <10> Trying to retrieve appliances connected to HomeConnect account...
2022-03-25 06:55:52.243 +01:00 [DBG] <10> Found device in account: WM132
2022-03-25 06:55:52.244 +01:00 [INF] <10> Authentication complete, device retrieved.
2022-03-25 06:55:52.256 +01:00 [DBG] <10> Device is not online.

I can retrieve the appliance from the service: that means the authentication and connection to the API are fine._

Something weird is happening with the event distribution within the HomeConnect service. This was working fine earlier this year. 

Honestly: I don't like being dependent on cloud-services and generally try to interface with devices directly, but it seems more and more manufacturers are pushing their cloud services (for good reason: the normal consumer doesn't write software or installs homebridge).

**Comment by marioverhaeg** [comment]
@thoukydides which authentication scheme are you using for your plugin? DeviceFlow or Authorization Code Grant Flow?

**Comment by thoukydides** [comment]
> which authentication scheme are you using for your plugin? DeviceFlow or Authorization Code Grant Flow?

Authorization Code Grant Flow for normal usage. This is necessary because Homebridge doesn't generally have any user interface - just a log file output.

Device Flow with the simulated appliances, but short-circuiting the sequence by grabbing the authorisation code directly from the HTTP redirect, rather than actually fetching the redirect page.

**Comment by smhex** [comment]
Yeah, looking forward to getting an update on this. I don’t see any chance to improve the situation myself. @thoukydides will you get an information once the update is available? Or is there a way to subscribe it?

**Comment by thoukydides** [comment]
@smhex if I receive another email from the Home Connect team providing an update on this issue then I will post it here.

**Comment by marioverhaeg** [comment]
For me the event channel seems to be stable at this moment, although HomeConnect did not confirm any changes. Can anyone else observe an increase in stability of the event channel?

**Comment by smhex** [comment]
Unfortunately I don’t see any improvements. The dish washer runs stable, the other appliances not. It’s still hard to catch the error…

**Comment by marioverhaeg** [comment]
Did you try to restart the HomeBridge to see if a new subscription to the event channel does the trick? Anyway, I will keep an eye on the situation in the next couple of days.

**Comment by smhex** [comment]
Indeed, I noticed an improvement during the last days. I was able to receive a stable event stream for my dryer which was not the case for a long time. I will have a closer look on this when the washing machine is also running.

**Comment by smhex** [comment]
It seams that the event streams are working now. There are still issues when the backend is not working properly, but that's obvious and can easily checked by looking at @thoukydides monitor page 😀. Thank you all for digging into this!
